Article,Unit,Value
Άρθρο 25,Γραφείο Φύλαξης,"1) Εφορεία Αρχαιοτήτων Πόλεως Αθηνών 2) Εφορεία Αρχαιοτήτων Ανατολικής Αττικής 3) Εφορεία Αρχαιοτήτων Πειραιώς και νήσων 4) Εφορεία Αρχαιοτήτων Κορινθίας 5) Εφορεία Αρχαιοτήτων Αργολίδας 6) Εφορεία Αρχαιοτήτων Ηλείας 7) Εφορεία Αρχαιοτήτων Λακωνίας 8) Εφορεία Αρχαιοτήτων Μεσσηνίας 9) Εφορεία Αρχαιοτήτων Φωκίδος 10) Εφορεία Αρχαιοτήτων Ημαθίας 11) Εφορεία Αρχαιοτήτων Κυκλάδων 12) Εφορεία Αρχαιοτήτων Δωδεκανήσου 13) Εφορεία Αρχαιοτήτων Ηρακλείου.
Το Γραφείο Φύλαξης - Πληροφόρησης είναι αρμόδιο 
για τον προγραμματισμό και έλεγχο της φύλαξης των 
Μουσείων, αποθηκών αρχαίων, αρχαιολογικών χώρων 
και εν γένει αρχαιολογικών εγκαταστάσεων, την τήρηση και εποπτεία της φύλαξης κατά τις ημέρες των 
εξαιρέσιμων και αργιών και τη σύνταξη των σχετικών 
καταστάσεων για την αποζημίωση των προσφερομένων 
υπηρεσιών κατά τις ημέρες αυτές, οι οποίες εγκρίνονται 
από τον Προϊστάμενο. Επιπλέον μεριμνά για την ευταξία αρχαιολογικών χώρων και μουσείων και εν γένει για 
την εύρυθμη λειτουργία τους, καθώς και για την ευπρεπή συμπεριφορά του αρχαιοφυλακτικού προσωπικού, 
όπως επίσης συντονίζει τους ορισμένους υπεύθυνους 
αρχιφύλακες.
Του Γραφείου ορίζεται επικεφαλής υπάλληλος του 
Κλάδου ΔΕ Φύλαξης – Πληροφόρησης, ειδικότητας Ημερησίων Φυλάκων. Το Γραφείο υπάγεται απευθείας στον 
Προϊστάμενο της Εφορείας Αρχαιοτήτων, ενώ εποπτεύει 
και συντονίζει τους κατά τόπους υπευθύνους αρχιφύλακες αρχαιολογικών χώρων ή μουσείων της οικείας 
Περιφερειακής Υπηρεσίας.
Σε όσες οργανικές μονάδες δεν συγκροτείται το σχετικό Γραφείο, οι αρμοδιότητές του αποτελούν καθήκοντα 
των ορισμένων ως υπευθύνων αρχιφυλάκων, οι οποίοι 
αναφέρονται στον εκάστοτε Προϊστάμενο της Περιφερειακής Υπηρεσίας.
Ο υπεύθυνος αρχιφύλακας αρχαιολογικού χώρου, 
ιστορικού τόπου ή μουσείου είναι υπάλληλος του Κλάδου ΔΕ Φύλαξης – Πληροφόρησης, ειδικότητας Ημερησίων Φυλάκων είναι αρμόδιος για: την ασφάλεια, τη 
φύλαξη αρχαιολογικών μουσείων, χώρων, αποθηκών 
αρχαιοτήτων και εν γένει αρχαιολογικών εγκαταστάσεων. Συντονίζει και εποπτεύει το αρχαιοφυλακτικό προσωπικό στην περιοχή ευθύνης του. Επιπλέον, μεριμνά για 
την ευταξία και εύρυθμη λειτουργία της, καθώς και για 
την ευπρεπή συμπεριφορά των υπαλλήλων του Κλάδου/
Ειδικότητας ΔΕ Φύλαξης - Πληροφόρησης. Ο αρχιφύλακας οφείλει να συνδράμει το έργο των τμημάτων των 
ΕΦΑ και ΕΠΥ, ενώ είναι δυνατόν να επικουρείται στο έργο 
του από αναπληρωτή/ες αρχιφύλακα, οι οποίοι, κατόπιν 
πρότασης του, ορίζονται με απόφαση του Προϊσταμένου 
των ΕΦΑ και ασκούν τα καθήκοντα, που τους ανατίθενται. Εφόσον στην ΕΦΑ λειτουργεί Γραφείο Φύλαξης – 
Πληροφόρησης τότε ο/οι αρχιφύλακες συνεργάζονται 
άμεσα και καθημερινά με τον προϊστάμενο του Γραφείου 
στον οποίο αναφέρονται.
Γραφεία Οικοδομικών και Εργατοτεχνικών Εργασιών
Στις παρακάτω Περιφερειακές Υπηρεσίες συγκροτείται 
Γραφεία Οικοδομικών και Εργατοτεχνικών Εργασιών. 1) Εφορεία Αρχαιοτήτων Πόλεως Αθηνών. 2) Εφορεία Αρχαιοτήτων Θεσσαλονίκης.
Το Γραφείο, Οικοδομικών και Εργατοτεχνικών Εργασιών είναι αρμόδιο για το συντονισμό πάσης φύσεως οικοδομικών και εργατοτεχνικών εργασιών που λαμβάνουν 
χώρα στην Εφορεία. Του Γραφείου ορίζεται επικεφαλής 
από τις ειδικότητες Εργατοτεχνιτών και Μαρμαροτεχνιτών. Το Γραφείο υπάγεται απευθείας στον Προϊστάμενο 
της Εφορείας Αρχαιοτήτων.
ΕΙΔΙΚΕΣ ΠΕΡΙΦΕΡΕΙΑΚΕΣ ΥΠΗΡΕΣΙΕΣ"
Άρθρο 26,Τμήμα Εναλίων Αρχαιολογικών Χώρων και Μνημείων και Ερευνών,"αα) Τον προγραμματισμό, την τεχνική οργάνωση και 
πραγματοποίηση υποβρυχίων αρχαιολογικών ανασκαφών ή εν γένει ερευνών, για τον εντοπισμό, την εξερεύνηση, τη διάσωση και την ανέλκυση των εναλίων 
αρχαιοτήτων. ββ) Την οργάνωση και λήψη μέτρων για την προστασία και διασφάλιση των ευρισκομένων στους βυθούς 
αρχαιοτήτων. γγ) Την εποπτεία και τον έλεγχο των διεξαγόμενων από 
ημεδαπούς και αλλοδαπούς οργανισμούς ή ιδιώτες, πάσης φύσεως υποβρύχιων ερευνών και δραστηριοτήτων. δδ) Την προστασία και τη διαχείριση ενάλιων αρχαιολογικών χώρων, επισκέψιμων ή μη σε συνεργασία με τις 
συναρμόδιες Υπηρεσίες του ΥΠ.ΠΟ.Α."
Άρθρο 26,Τμήμα Ερευνών Αρχαιολογικών Έργων και Τεκμηρίωσης Δημοσίευσης και Αρχείου,"αα) Την καταγραφή των ευρισκομένων στο βυθό αρχαίων αλλά και όσων ανελκύονται, καθώς και η κατάρτιση – ενημέρωση του αναγκαίου τεκμηριωτικού αρχείου. ββ) Την οργάνωση και λειτουργία βιβλιοθήκης, καθώς 
και την τυχόν εκδοτική δραστηριότητα. γγ) Την υποστήριξη της οργάνωσης μονίμων και περιοδικών εκθέσεων, τις αποτυπώσεις και τοπογραφικές 
μελέτες, την επίβλεψη εκτέλεσης μελετών λιμενικών έργων, καθώς και τη συντήρηση και λειτουργία των πάσης 
φύσεως διοικητικών, μουσειακών και αποθηκευτικών 
εγκαταστάσεων και κτηριακών υποδομών της Εφορείας, 
σε συνεργασία, όπου απαιτείται, και με τις αρμόδιες οργανικές μονάδες της Γενικής Διεύθυνσης Αναστήλωσης, 
Μουσείων και Τεχνικών Έργων."
Άρθρο 26,Τμήμα Συντήρησης Αρχαιοτήτων και Έργων Τέχνης,"αα) Τον καθαρισμό, τη συντήρηση και την αποκατάσταση των πάσης φύσεως εναλίων αρχαιοτήτων και 
μνημείων. ββ) Τη συντήρηση και προστασία των πάσης φύσεως 
αρχαιοτήτων και την εκπόνηση των σχετικών μελετών 
συντήρησης και αισθητικής αποκατάστασής τους. γγ) Την υποστήριξη μονίμων και περιοδικών εκθέσεων, 
τη συντήρηση, αποκατάσταση και αισθητική παρουσίαση των μνημείων και πολιτιστικών αγαθών. δδ) Την εκπόνηση και αξιολόγηση μελετών συντήρησης και προστασίας αρχαιοτήτων και έργων τέχνης, την 
επίβλεψη εφαρμογής τους. εε) Την τήρηση αρχείου έργων και μελετών συντήρησης, επιστημονικών εργασιών και εργασιών τεκμηρίωσης."
Άρθρο 26,Τμήμα Διοικητικής Οικονομικής και Τεχνικής Υποστήριξης,"αα) Τη διοικητική, οικονομική, γραμματειακή υποστήριξη του έργου της Εφορείας. ββ) Τον προγραμματισμό και τον έλεγχο της φύλαξης των Μουσείων, αποθηκών αρχαίων, αρχαιολογικών 
χώρων και εν γένει αρχαιολογικών εγκαταστάσεων, την 
τήρηση και εποπτεία της φύλαξης κατά τις ημέρες των 
εξαιρέσιμων και αργιών και τη σύνταξη των σχετικών 
καταστάσεων για την αποζημίωση των προσφερομένων 
υπηρεσιών κατά τις ημέρες αυτές. γγ) Τη μέριμνα για την συντήρηση, φύλαξη και κίνηση 
των κρατικών οχημάτων και του λοιπού εξοπλισμού της 
Εφορείας. δδ) Τη διενέργεια πάσης φύσεως συμβάσεων, προμηθειών έργων, μελετών, αγαθών και υπηρεσιών τόσο 
χωρικά, όσο και στο πεδίο αρμοδιότητάς τους"
Άρθρο 27,Τμήμα Αρχαιοτήτων των Προϊστορικών και Ιστορικών Περιόδων,"αα) Τον προγραμματισμό, την τεχνική οργάνωση και 
την πραγματοποίηση σπηλαιολογικών ανασκαφών ή εν 
γένει ερευνών, για τον εντοπισμό, την εξερεύνηση, τη 
διάσωση και την προστασία των καταλοίπων που βρίσκονται μέσα στα σπήλαια. ββ) Την προώθηση της μελέτης και ανάδειξης των 
ευρημάτων σε ειδικά σπηλαιολογικά μουσεία ή σε αίθουσες άλλων δημόσιων μουσείων. γγ) Τη μέριμνα για την οργάνωση εργαστηρίου λιθοτεχνίας. δδ) Τη φροντίδα για τον ευπρεπισμό, τη διαμόρφωση 
του χώρου των σπηλαίων και του περιβάλλοντος φυσικού τοπίου, τη διατήρηση και προστασία αυτών, την επίβλεψη των διενεργουμένων ανασκαφών, τη διενέργεια 
αυτοψιών για τον εντοπισμό σπηλαίων. εε) Τη μέριμνα για την καταγραφή και την ηλεκτρονική 
καταχώρηση εγκοίλων, θέσεων και ευρημάτων, την τήρηση αρχείου φωτογραφιών, σχεδίων, χαρτών, κηρύξεων, καθώς και την οργάνωση και λειτουργία βιβλιοθήκης."
Άρθρο 27,Τμήμα Αρχαιολογικών Έργων και Μελετών Γεωλογίας και Παλαιοντολογίας,"αα) Τη μέριμνα για τεχνικά θέματα που αφορούν στην 
δι’ αυτεπιστασίας, σύμφωνα με τις ισχύουσες διατάξεις, 
τη μελέτη και εκτέλεση έργων, την αποτύπωση και τοπογράφηση, τη στερέωση, αποκατάσταση, μνημείων, 
τη διαμόρφωση και ανάδειξη αρχαιολογικών χώρων και 
μνημείων. ββ) Την εκπόνηση μουσειογραφικών μελετών. γγ) Τη συντήρηση και λειτουργία των πάσης φύσεως 
διοικητικών, μουσειακών και αποθηκευτικών εγκαταστάσεων και κτηριακών υποδομών της Εφορείας, σε συνεργασία με τις αρμόδιες υπηρεσίες της Γενικής Διεύθυνσης 
Αναστήλωσης, Μουσείων και Τεχνικών Έργων. δδ) Την κατάρτιση προτάσεων για την ένταξη νέων 
έργων σε συγχρηματοδοτούμενα προγράμματα. εε) Την τεχνική τεκμηρίωση και την έρευνα στατικών, 
αρχιτεκτονικών και γενικότερα τεχνικών ζητημάτων των 
μνημείων και τη δημοσίευση των αποτελεσμάτων της. στστ) Τον εντοπισμό, εξερεύνηση και αξιολόγηση 
σπηλαίων, καθώς και την επίβλεψη υλοποίησης μελετών 
ανάδειξης αυτών, τις γεωλογικές έρευνες και μελέτες από 
πλευράς γεωμορφολογίας, υδρογεωλογίας, παλαιοπεριβάλλοντος, ιζηματολογίας, πετρολογίας και γεωχημείας 
των σπηλαίων, τη λειτουργία Γεωλογικού Εργαστηρίου, 
τη δημιουργία Τράπεζας Πετρωμάτων, την οργάνωση 
έρευνας σε παλαιοντολογικές θέσεις, καθώς και τη μελέτη παλαιοντολογικών ευρημάτων, σπηλαίων και ανοικτών θέσεων. Επίσης, την αποτύπωση και τοπογραφική 
μελέτη των σπηλαίων και παλαιοντολογικών θέσεων, τις 
γεωτεχνικές μελέτες, στερεώσεις, διαμορφώσεις και αξιοποίηση των σπηλαίων και του περιβάλλοντος χώρου."
Άρθρο 27,Τμήμα Συντήρησης Αρχαιοτήτων και Έργων Τέχνης,"αα) Τη συντήρηση των σπηλαίων, των εντός αυτών 
ευρισκομένων αρχαιοτήτων, καθώς και των εξ’ αυτών 
προερχομένων κινητών αρχαίων. ββ) Την υποστήριξη μονίμων και περιοδικών εκθέσεων, τη συντήρηση, προστασία, αποκατάσταση και 
αισθητική παρουσίαση των μνημείων και πολιτιστικών 
αγαθών. γγ) την εκπόνηση και αξιολόγηση μελετών συντήρησης και προστασίας αρχαιοτήτων και έργων τέχνης, την 
επίβλεψη εφαρμογής τους. δδ) την τήρηση αρχείου έργων και μελετών συντήρησης, επιστημονικών εργασιών και εργασιών τεκμηρίωσης."
Άρθρο 27,Τμήμα Διοικητικής Οικονομικής και Τεχνικής Υποστήριξης,"αα) Τη διοικητική, οικονομική, γραμματειακή υποστήριξη του έργου της Εφορείας. ββ) Τον προγραμματισμό και έλεγχο της φύλαξης, ευταξίας και καθαριότητας των Μουσείων, αποθηκών αρχαίων, αρχαιολογικών χώρων και εν γένει αρχαιολογικών 
εγκαταστάσεων, την τήρηση και εποπτεία της φύλαξης 
κατά τις ημέρες των εξαιρέσιμων και αργιών και τη σύνταξη των σχετικών καταστάσεων για την αποζημίωση 
των προσφερομένων υπηρεσιών κατά τις ημέρες αυτές. γγ) Την μέριμνα για την συντήρηση, φύλαξη και κίνηση 
των κρατικών οχημάτων και του λοιπού εξοπλισμού της 
Εφορείας. δδ) Τη διενέργεια πάσης φύσεως συμβάσεων, προμηθειών έργων, μελετών, αγαθών και υπηρεσιών τόσο 
χωρικά, όσο και στο πεδίο αρμοδιότητάς τους."
Άρθρο 29,Τμήμα Συλλογής,"αα) την έρευνα, μελέτη, καταγραφή, προστασία, διάσωση, ανάδειξη, δημοσίευση, φωτογραφική τεκμηρίωση 
και προβολή των έργων γλυπτικής από λίθο. ββ) Τη χορήγηση άδειας μελέτης αρχαίων αντικειμένων, τη χορήγηση άδειας εξαγωγής μη προστατευομένων από τη νομοθεσία αντικειμένων. γγ) Τον προγραμματισμό, σχεδιασμό και οργάνωση 
αρχαιολογικών εκθέσεων (περιοδικών ή μονίμων) σε 
συνεργασία με το Τμήμα Εκθέσεων, Επικοινωνίας και 
Εκπαίδευσης, καθώς και το Τμήμα Τεχνικής Υποστήριξης και Μουσειογραφίας."
Άρθρο 29,Τμήμα Συλλογών Αγγείων Έργων Μεταλλοτεχνίας και Μικροτεχνίας,"αα) την έρευνα, μελέτη, καταγραφή, προστασία, διάσωση, ανάδειξη, δημοσίευση, φωτογραφική τεκμηρίωση και προβολή των αγγείων, ειδωλίων, κοσμημάτων, 
σφραγιδολίθων, ελεφάντινων αντικειμένων ιστορικής 
περιόδου, γυάλινων σκευών. ββ) την έρευνα, μελέτη, καταγραφή, προστασία, διάσωση, ανάδειξη, δημοσίευση, φωτογραφική τεκμηρίωση 
και προβολή των έργων μεταλλοτεχνίας του Μουσείου 
από χαλκό, άργυρο, χρυσό, σίδηρο και μόλυβδο καθώς 
και μεγάλης πλαστικής από μέταλλο. γγ) Τον προγραμματισμό, σχεδιασμό και οργάνωση 
αρχαιολογικών εκθέσεων (περιοδικών ή μονίμων) σε 
συνεργασία με το Τμήμα Εκθέσεων, Επικοινωνίας και 
Εκπαίδευσης, καθώς και το Τμήμα Τεχνικής Υποστήριξης και Μουσειογραφίας. δδ) Τη χορήγηση άδειας μελέτης αρχαίων αντικειμένων και τη χορήγηση άδειας εξαγωγής μη προστατευομένων από τη νομοθεσία αντικειμένων."
Άρθρο 29,Τμήμα Συλλογών Προϊστορικών Αιγυπτιακών Κυπριακών και Ανατολικών Αρχαιοτήτων,"αα) Την έρευνα, μελέτη, καταγραφή, προστασία, διάσωση, ανάδειξη, δημοσίευση, φωτογραφική τεκμηρίωση 
και προβολή των Προϊστορικών, Αιγυπτιακών, Κυπριακών και Ανατολικών αρχαιοτήτων ανεξαρτήτως υλικού. ββ) Τη χορήγηση άδειας μελέτης αρχαίων αντικειμένων και τη χορήγηση άδειας εξαγωγής μη προστατευομένων από τη νομοθεσία αντικειμένων γγ) Τον προγραμματισμό, σχεδιασμό και οργάνωση 
αρχαιολογικών εκθέσεων (περιοδικών ή μονίμων) σε 
συνεργασία με το Τμήμα Εκθέσεων, Επικοινωνίας και 
Εκπαίδευσης, καθώς και το Τμήμα Τεχνικής Υποστήριξης και Μουσειογραφίας."
Άρθρο 29,Τμήμα Συντήρησης Χημικών και Φυσικών Ερευνών και Αρχαιομετρίας,"αα) Τον καθαρισμό, τη συντήρηση, την αποκατάσταση 
και την αισθητική παρουσίαση των αντικειμένων του 
Μουσείου και κάθε φύσης εκθεμάτων. Επίσης την εκπόνηση μελετών συντήρησης και την υποστήριξη μονίμων 
και περιοδικών εκθέσεων. ββ) Τη μέριμνα για την καλή λειτουργία των εργαστηρίων συντήρησης αγγείων, μετάλλων, γλυπτών, εκμαγείων, οργανικών υλών, χαρτιού, αρνητικών φωτογραφιών, 
καθώς και του Εργαστηρίου Φυσικών, Χημικών Ερευνών 
και Αρχαιομετρίας. γγ) Την έρευνα για τις μεθόδους και τα υλικά συντήρησης, τη διάγνωση των μηχανισμών και των αποτελεσμάτων της φθοράς επί των αρχαίων. δδ) Την αρχαιομετρική έρευνα. εε) την εκπόνηση μελετών συντήρησης και προστασίας αρχαιοτήτων και έργων τέχνης, την επίβλεψη εφαρμογής τους. στστ) την τήρηση αρχείου έργων και μελετών συντήρησης, επιστημονικών εργασιών και εργασιών τεκμηρίωσης."
Άρθρο 29,Τμήμα Εκθέσεων Επικοινωνίας και Εκπαίδευσης,"αα) Την εκπόνηση και εφαρμογή μουσειολογικών 
μελετών και την έκθεση των αρχαίων αντικειμένων. Το 
σχεδιασμό, την οργάνωση και την παρουσίαση αρχαιολογικών, περιοδικών ή μονίμων, εκθέσεων, σε συνεργασία με τα λοιπά τμήματα του Μουσείου και τις αρμόδιες 
Διευθύνσεις της Κεντρικής Υπηρεσίας. ββ) Το σχεδιασμό, την οργάνωση, την παρουσίαση και 
αξιολόγηση εκπαιδευτικών και άλλων προγραμμάτων, 
δραστηριοτήτων και εκδηλώσεων. γγ) την επικοινωνιακή διαχείριση και προβολή των 
δράσεων του Μουσείου."
