Article,Unit,Value
Άρθρο 59,Τμήμα Κατάρτισης και Εκτέλεσης Τακτικού Προϋπολογισμού ΠΔΕ και Εκκαθάρισης Μισθοδοσίας,"αα) Το σχεδιασμό, την κατάρτιση και την τροποποίηση 
του Μεσοπρόθεσμου Πλαισίου Δημοσιονομικής Στρατηγικής (ΜΠΔΣ) και του Τακτικού Προϋπολογισμού. ββ) Την παρακολούθηση, επεξεργασία και αναφορά 
της διάθεσης πιστώσεων. γγ) Τη διασφάλιση της διατήρησης των ορίων των 
διαθέσιμων πιστώσεων του Προϋπολογισμού και την 
υποβολή προτάσεων για ανακατανομή των πιστώσεων 
στο Γενικό Λογιστήριο του Κράτους. δδ) Την κατάρτιση, επεξεργασία και αναθεώρηση του 
Προγράμματος Δημοσίων Επενδύσεων (ΠΔΕ). εε) Την παρακολούθηση και εκτέλεση του Προϋπολογισμού του Εθνικού Συμβουλίου Καταπολέμησης Ντόπινγκ (ΕΣΚΑΝ). στστ) Την εισήγηση εκτέλεσης προγραμμάτων αθλητικών έργων, την ένταξή τους στον Εθνικό Χωροταξικό 
Σχεδιασμό, την παρακολούθηση της προώθησης και της 
εφαρμογής τους και τη μέριμνα για την ομαλή χρηματοδότησή τους. ζζ) Τον ορισμό των υπολόγων - διαχειριστών και των 
υπευθύνων λογαριασμών των έργων του ΠΔΕ για την 
πληρωμή των εκτελούμενων από τις υπηρεσίες έργων 
και έργων εξουσιοδότησης εκτελουμένων με ευθύνη 
Ν.Π.Δ.Δ. και Ν.Π.Ι.Δ. ηη) Την παρακολούθηση των κατανομών και των 
απορροφήσεων των εγκεκριμένων πιστώσεων στο 
ΠΔΕ, τη συγκέντρωση των οικονομικών στοιχείων για 
τις επιμέρους κινήσεις των τραπεζικών λογαριασμών 
των έργων που τηρούνται στην Τράπεζα της Ελλάδος 
(ΤτΕ), τον έλεγχο και την επεξεργασία των γενικών απολογιστικών στοιχείων. θθ) Την τήρηση του Μητρώου δεσμεύσεων για τον 
Τακτικό Προϋπολογισμό και το ΠΔΕ και την εποπτεία 
και τον έλεγχο για την ορθή και έγκαιρη καταχώριση 
των στοιχείων των ανωτέρω στις οικείες διαδικτυακές 
εφαρμογές. ιι) Την έκδοση των χρηματικών ενταλμάτων προπληρωμής, τη μέριμνα για τον ορισμό υπολόγων αυτών, τον 
έλεγχο των αποδόσεών τους και την τακτοποίησή τους. ιαια) Την έκδοση των αποφάσεων χρηματοδότησης 
έργων του ΠΔΕ με συνακόλουθη πίστωση των λογαριασμών των έργων που τηρούνται στην Τράπεζα της 
Ελλάδος (ΤτΕ). ιβιβ) Τη μέριμνα για χορήγηση οικονομικών επιβραβεύσεων σε διακεκριμένους αθλητές και προπονητές με 
εξαιρετικές αγωνιστικές διακρίσεις (πριμ). ιγιγ) Τον έλεγχο, και την εκκαθάριση των αποδοχών και 
των κάθε είδους αμοιβών του προσωπικού της Γενικής 
Γραμματείας Αθλητισμού (Γ.Γ.Α.) μέσω της Ενιαίας Αρχής 
Πληρωμών. ιδιδ) Την τήρηση του μισθολογικού μητρώου του Τακτικού Προσωπικού και των στοιχείων για την μισθοδοσία του μη τακτικού προσωπικού της ΓΓΑ. ιειε) Την έκδοση τίτλου για την πληρωμή των αποδοχών και κάθε είδους αμοιβών, μέσα στα καθοριζόμενα 
κατά μήνα όρια πληρωμών και εντός των προβλεπομένων προθεσμιών από το ενωσιακό και εθνικό κανονιστικό πλαίσιο. ιστιστ) Τον έλεγχο νομιμότητας και κανονικότητας, 
καθώς και την εκκαθάριση δαπανών του Τομέα Αθλητισμού, με βάση τα πλήρη και νόμιμα δικαιολογητικά 
αυτών. ιζιζ) Την κατάρτιση του σχεδίου απόφασης ανάληψης 
υποχρεώσεων κατόπιν τεκμηριωμένου αιτήματος του 
διατάκτη και την καταχώριση των αναλαμβανόμενων 
δεσμεύσεων στο οικεία λογιστικά βιβλία και στο Μητρώο 
Δεσμεύσεων. ιηιη) Τον έλεγχο και την επεξεργασία των δημοσιονομικών στοιχείων από οικείες διαδικτυακές εφαρμογές για 
τα Μητρώα Δεσμεύσεων του Τακτικού Προϋπολογισμού 
και του Προγράμματος Δημοσίων Επενδύσεων. ιθιθ) Την αποκατάσταση πάγιων προκαταβολών. κκ) Τον έλεγχο τήρησης των περί ανάληψης υποχρεώσεων διατάξεων και την παροχή βεβαίωσης επί των 
σχεδίων των σχετικών πράξεων, για την ύπαρξη της 
απαιτούμενης πίστωσης και για τη μη υπέρβαση του 
οριζόμενου κάθε φορά από το αρμόδιο όργανο ποσοστού διάθεσης της πίστωσης. κακα) Τη σύνταξη έκθεσης προς την αρμόδια ΔΥΕΕ 
σύμφωνα με τις διατάξεις της παραγράφου 3δ του άρθρου 66 
του N# 4270/2014 όπως ισχύει και του περί ανάληψης 
υποχρεώσεων από τους διατάκτες προεδρικού διατάγματος (ΠΔ#. 80/2016, Α΄145). κβκβ) Την έκδοση τίτλου για την πληρωμή των δαπανών του Τομέα Αθλητισμού, μέσα στα καθοριζόμενα 
κατά μήνα όρια πληρωμών εντός των προβλεπομένων 
προθεσμιών από το ενωσιακό και εθνικό κανονιστικό 
πλαίσιο. κγκγ) Τη σύνταξη έκθεσης επί διαφωνιών με το διατάκτη ως προς τη νομιμότητα και κανονικότητα των εκκαθαριζομένων δαπανών και υποβολή της μετά του σχετικού φακέλου στη Διεύθυνση Συντονισμού και Ελέγχου 
Εφαρμογής Δημοσιολογιστικών Διατάξεων με σχετική 
κοινοποίηση στην αρμόδια Γενική Διεύθυνση Δημοσιονομικών Ελέγχων του Γενικού Λογιστηρίου του Κράτους, 
σύμφωνα με τα οριζόμενα στην παράγραφο 1 του άρθρου 26 
του N# 4270/2014. κδκδ) Τη σύνταξη έκθεσης προς την αρμόδια Υπηρεσία προκειμένου να κινηθεί η προβλεπόμενη από τις 
κείμενες διατάξεις διαδικασία του επιτόπου ελέγχου. κεκε) Την εισήγηση αρμοδίως για καταλογισμό δημοσίου υπολόγου, υπεύθυνου λογαριασμού, καθώς και 
λαβόντα αχρεώστητης πληρωμής. κστκστ) Την παροχή απόψεων στα Δικαστήρια, εκτέλεση δικαστικών αποφάσεων και κοινοποίηση στην αρμόδια Δημοσιονομική Υπηρεσία Εποπτείας και Ελέγχου 
(ΔΥΕΕ) των δικαστικών αποφάσεων αυτών από τις οποίες 
προκύπτει επιβάρυνση στον προϋπολογισμό του φορέα. κζκζ) Τη μέριμνα για την αποτροπή συσσώρευσης 
οφειλών. κηκη) Την τήρηση των λογιστικών βιβλίων που προβλέπονται από τις ισχύουσες διατάξεις για τις δαπάνες 
του Τομέα Αθλητισμού. κθκθ) Την καταχώριση των στοιχείων των δικαιούχων 
δαπανών και τήρηση του μητρώου αυτών. λλ) Την κατά μήνα παρακολούθηση σε ξεχωριστή 
κατάσταση των εγγραφών που γίνονται στα λογιστικά 
βιβλία του φορέα για κάθε δευτερεύοντα διατάκτη. λαλα) Την παρακολούθηση του βιβλίου υπολόγων και 
υπεύθυνων λογαριασμών και εισήγηση στον Γ.Δ.Ο.Υ. για 
την έκδοση εντολών προς τους οικείους εκκαθαριστές 
αποδοχών για την επίσχεση των αποδοχών δημόσιων 
υπολόγων που καθυστερούν την απόδοση λογαριασμού, 
καθώς και εισήγηση στον αρμόδιο Επίτροπο του Ελεγκτικού Συνεδρίου για τον καταλογισμό του υπερήμερου 
υπολόγου σύμφωνα με τις κείμενες διατάξεις. λβλβ) Την έκδοση συμψηφιστικών ενταλμάτων για την 
εμφάνιση των εξόδων που βαρύνουν το Πρόγραμμα 
Δημοσίων Επενδύσεων στη δημόσια ληψοδοσία, καθώς και έκδοση λοιπών συμψηφιστικών χρηματικών 
ενταλμάτων, όπου προβλέπεται για δαπάνες του Τομέα 
Αθλητισμού. λγλγ) Τη συγκέντρωση δεδομένων από το Μητρώο 
Δεσμεύσεων και υποβολή σχετικών αναφορών στις αρμόδιες οργανικές μονάδες δημοσιονομικών αναλύσεων 
και αναφορών. λδλδ) Την παροχή στοιχείων, βεβαιώσεων και οδηγιών για τις αποδοχές, πρόσθετες αμοιβές, αποζημιώσεις, 
κρατήσεις ΚΛΠ#.. λελε) Την έκδοση καταλογιστικών πράξεων σε επιχορηγούμενους φορείς."
Άρθρο 59,Τμήμα Προμηθειών Διαχείρισης Υλικού και Υποδομών,"αα) Τη διενέργεια πρόχειρων και ανοικτών (δημόσιων και διεθνών) διαγωνισμών σε συνεργασία με τη Διεύθυνση Προμηθειών, Υποδομών και Απαλλοτριώσεων 
Τομέα Πολιτισμού. ββ) Την κατάρτιση του Ενιαίου Προγράμματος Προμηθειών πάσης φύσεως υλικών, εξοπλισμού και εφοδίων 
για τις ανάγκες των υπηρεσιών και για τη συντήρηση και 
αποκατάσταση κάθε είδους. γγ) Τη σύναψη, διαχείριση και εποπτεία εκτέλεσης συμβάσεων προμηθειών καθώς και υπεργολαβιών. δδ) Την ενημέρωση του Μητρώου δεσμεύσεων για 
το σύνολο των δαπανών αρμοδιότητας του Τμήματος 
σε συνεργασία με το Τμήμα Κατάρτισης και Εκτέλεσης 
Τακτικού Προϋπολογισμού, ΠΔΕ και Εκκαθάρισης Μισθοδοσίας. εε) Την εποπτεία για την παραλαβή, αποθήκευση και 
διακίνηση των προμηθευόμενων υλικών και εφοδίων, 
την έκδοση δελτίων εισαγωγής και εξαγωγής και την 
καταστροφή και εκποίηση του άχρηστου υλικού. στστ) Τη συγκέντρωση και επεξεργασία στοιχείων για 
τον προγραμματισμό των δαπανών, που αφορούν στην 
καθαριότητα, στη συντήρηση, στην ασφάλεια, στη φύλαξη των κτιρίων και των εγκαταστάσεων τους, στη λήψη 
μέτρων πυρασφάλειας. ζζ) Την τήρηση Μητρώου οχημάτων της Γενικής Γραμματείας Αθλητισμού (ΓΓΑ). ηη) Την αποδοχή δωρεών για λογαριασμό της ΓΓΑ."
Άρθρο 59,Τμήμα Παρακολούθησης Εποπτευομένων,"αα) Τον έλεγχο, την κατάρτιση και υλοποίηση των προϋπολογισμών των εποπτευομένων φορέων, καθώς και 
την επεξεργασία και την έκδοση αποφάσεων έγκρισης 
προϋπολογισμών και απολογισμών των εποπτευομένων 
και λοιπών φορέων σύμφωνα με την ισχύουσα νομοθεσία. ββ) Την παρακολούθηση της οικονομικής διαχείρισης των εποπτευομένων φορέων, των ελλειμμάτων και 
χρεών που εμφανίζουν σε τακτική (τριμηνιαία/μηνιαία) 
βάση και ανάλυση και επεξεργασία των οικονομικών 
τους στοιχείων. γγ) Τη συγκέντρωση και τον έλεγχο των δικαιολογητικών καθώς και την έκδοση αποφάσεων επιχορηγήσεων 
και τη διαβίβασή τους για εκκαθάριση-ενταλματοποίηση 
στο αρμόδιο Τμήμα Κατάρτισης και Εκτέλεσης Τακτικού 
Προϋπολογισμού, ΠΔΕ και Εκκαθάρισης Μισθοδοσίας. δδ) Την αξιολόγηση των αποτελεσμάτων και την παρακολούθηση των χορηγούμενων επιχορηγήσεων στους 
εποπτευόμενους και λοιπούς φορείς. εε) Τη διασφάλιση της ευθυγράμμισης των στόχων που 
τίθενται, μέσω των προϋπολογισμών των εποπτευομένων φορέων, με τους αντίστοιχους στόχους της δημοσιονομικής πολιτικής, καθώς και με τους στόχους του 
Προϋπολογισμού. στστ) Τον έλεγχο και την επεξεργασία των δημοσιονομικών στοιχείων των Εποπτευόμενων φορέων και την 
ηλεκτρονική καταγραφή τους στις διαδικτυακές εφαρμογές του Γενικού Λογιστηρίου του Κράτους όπου αυτό 
απαιτείται. ζζ) Τον έλεγχο και την επεξεργασία των απολογιστικών 
οικονομικών στοιχείων της εκτέλεσης του Προϋπολογισμού των εποπτευομένων και λοιπών φορέων καθώς και 
την αξιολόγησή τους. ηη) Τη συγκέντρωση των οικονομικών στοιχείων και 
τη σύνταξη των συγκεντρωτικών καταστάσεων τιμολογίων σύμφωνα με τον Κώδικα φορολογικής Απεικόνισης 
Συναλλαγών. θθ) Τον έλεγχο και χειρισμό των κατασχετηρίων αρμοδιότητας Γενικής Γραμματείας Αθλητισμού και τη διαβίβαση στην αρμόδια οργανική μονάδα της Γ.Γ.Α, για 
σχετικές ενέργειες. ιι) Τη διενέργεια λογιστικού και διαχειριστικού ελέγχου 
καθώς και ελέγχου κάθε στοιχείου που αποτελεί αντικείμενο της κείμενης σχετικής νομοθεσίας ή των καταστατικών των αθλητικών σωματείων των ενώσεων και των 
ομοσπονδιών και των άλλων επιχορηγούμενων φορέων 
και γνωμοδότηση για περικοπή της επιχορήγησης τους 
εφόσον διαπιστώνονται σοβαρές παραβάσεις. ιαια) Την άσκηση ελέγχου νομιμότητας επί των πρακτικών συνεδριάσεων των εποπτευόμενων φορέων 
(Ν.Π.Δ.Δ. και Ν.Π.Ι.Δ.) της Γενικής Γραμματείας Αθλητισμού, σύμφωνα με τις ισχύουσες διατάξεις και τον κανονισμό λειτουργίας αυτών."
Άρθρο 60,Τμήμα Παρακολούθησης Εποπτευόμενων και Λοιπών Φορέων,"αα) Τον έλεγχο και την εποπτεία κατάρτισης και υλοποίησης του ΜΠΔΣ και των προσχεδίων προϋπολογισμού των Εποπτευόμενων φορέων. ββ) Την παρακολούθηση της οικονομικής διαχείρισης 
των εποπτευόμενων φορέων, των ελλειμμάτων και χρεών που εμφανίζουν σε τακτική περιοδική (τριμηνιαία/μηνιαία) βάση, την ανάλυση και την επεξεργασία των 
οικονομικών τους στοιχείων. γγ) Την επεξεργασία και την έγκριση των προϋπολογισμών και απολογισμών των εποπτευόμενων και λοιπών 
φορέων σύμφωνα με την ισχύουσα νομοθεσία. δδ) Την έκδοση αποφάσεων επιχορηγήσεων, την αξιολόγηση των αποτελεσμάτων και την παρακολούθηση 
των χορηγούμενων επιχορηγήσεων στους εποπτευόμενους φορείς. εε) Τη διασφάλιση της ευθυγράμμισης των στόχων 
που τίθενται, μέσω των προϋπολογισμών των εποπτευόμενων φορέων, με τους αντίστοιχους στόχους της 
δημοσιονομικής πολιτικής, καθώς και με τους στόχους 
του Προϋπολογισμού του Υπουργείου Πολιτισμού και 
Αθλητισμού. στστ) Τη συνεργασία με το Τμήμα Καινοτόμων Υπηρεσιών και Απλούστευσης Διαδικασιών για την παρακολούθηση και αξιολόγηση της επίτευξης συγκεκριμένων 
ποιοτικών και ποσοτικών στόχων ώστε να διασφαλίζεται 
η ποιότητα των υπηρεσιών και η συνεχής βελτίωση και 
απλούστευση των διαδικασιών. ζζ) Την εποπτεία και τον έλεγχο για την ορθή και έγκαιρη καταχώριση στις ανάλογες διαδικτυακές (ή μη) εφαρμογές όπως αυτές εξελίσσονται διαχρονικά και σύμφωνα 
με το εκάστοτε θεσμικό πλαίσιο."
Άρθρο 60,Τμήμα Δημοσιονομικών Αναλύσεων και Αναφορών,"αα) Τον έλεγχο και την επεξεργασία των δημοσιονομικών στοιχείων των Εποπτευόμενων φορέων του 
Υπουργείου και την ηλεκτρονική καταγραφή τους στις 
διαδικτυακές εφαρμογές του Γενικού Λογιστηρίου του 
Κράτους και όπου αυτό απαιτείται. ββ) Την παραγωγή, τον έλεγχο και την επεξεργασία 
των οικονομικών απολογιστικών στοιχείων για την εκτέλεση του Προϋπολογισμού καθώς και την αξιολόγησή 
τους. γγ) Τη συγκέντρωση των οικονομικών στοιχείων και 
τη σύνταξη των συγκεντρωτικών καταστάσεων τιμολογίων σύμφωνα με τον Κώδικα φορολογικής Απεικόνισης 
Συναλλαγών."
Άρθρο 60,Τμήμα Χορηγιών,"αα) Την ανάληψη πρωτοβουλιών προσέλκυσης χορηγών και προβολής του θεσμού της πολιτιστικής χορηγίας. ββ) Τη διεκπεραίωση του συνόλου των διαδικασιών 
του N# 3525/2007 όπως τροποποιήθηκε και ισχύει. γγ) Την εισήγηση για αποδοχή ή μη των συμβάσεων 
πολιτιστικής χορηγίας που αφορούν στο Υπουργείο Πολιτισμού και Αθλητισμού. δδ) Την τήρηση και ανάρτηση στην ιστοσελίδα του 
Υπουργείου, του ετήσιου ενδεικτικού καταλόγου των 
πολιτιστικών δραστηριοτήτων του Υπουργείου Πολιτισμού και Αθλητισμού, που μπορούν να αποτελέσουν 
αντικείμενο πολιτιστικής χορηγίας, καθώς και τη σύνταξη και διατήρηση αρχείων πολιτιστικών χορηγιών για τα 
προηγούμενα έτη. εε) Τη συνεργασία με το Τμήμα Καινοτόμων Υπηρεσιών και Απλούστευσης Διαδικασιών του Υπουργείου για 
την παρακολούθηση και αξιολόγηση της επίτευξης συγκεκριμένων ποιοτικών και ποσοτικών στόχων ώστε να 
διασφαλίζεται η ποιότητα των υπηρεσιών και η συνεχής 
βελτίωση και απλούστευση των διαδικασιών."
Άρθρο 61,Αυτοτελές Γραφείο Πληρωμών και Λοιπών Οικονομικών Θεμάτων Αυτοτελές Γραφείο Πληρωμών και Λοιπών Οικονομικών Θεμάτων,"α) Την παραγωγή στο Ολοκληρωμένο Πληροφοριακό 
Σύστημα Δημοσιονομικής Πολιτικής (ΟΠΣΔΠ) ηλεκτρονικών εντολών μεταφοράς και πίστωσης λογαριασμού 
προς την Τράπεζα της Ελλάδος για την εξόφληση των 
εκδιδόμενων χρηματικών ενταλμάτων με πίστωση των 
τραπεζικών λογαριασμών των δικαιούχων και την απόδοση των διενεργούμενων κρατήσεων υπέρ τρίτων σε 
αυτούς. β) Την μέριμνα για τη διενέργεια συμψηφισμών και 
απόδοση στο Δημόσιο και στα οικεία ασφαλιστικά ταμεία των οφειλών των δικαιούχων που αναγράφονται 
στις σχετικές βεβαιώσεις φορολογικών και ασφαλιστικών οφειλών. γ) Την ενημέρωση των δικαιούχων και των φορέων για 
την έκδοση χρηματικών ενταλμάτων και την πληρωμή 
των δικαιούχων. δ) Την καταχώριση στοιχείων και τήρηση των Μητρώων Κατασχέσεων και Εκχωρήσεων.
"
